Title,Description,Status,Priority,Created At,Updated At,Completed At,Estimated Time (min),Actual Time (min),Time Efficiency
"Update documentation wiki","Update internal documentation, API guides, and onboarding materials to reflect recent changes and improvements.",completed,high,2025-07-07T17:25:23.271Z,2025-07-11T08:29:43.839Z,2025-07-11T08:29:43.839Z,398,251,Under-estimated
"Create icon set for navigation","Design consistent icon set for navigation elements ensuring clarity, accessibility, and visual harmony across the interface.",completed,low,2025-07-05T23:25:43.867Z,2025-07-08T19:58:00.799Z,2025-07-08T19:58:00.799Z,111,103,Under-estimated
"Create API documentation","Generate comprehensive API documentation with examples, authentication details, and integration guides.",completed,medium,2025-07-05T07:59:01.427Z,2025-07-08T02:06:48.552Z,2025-07-08T02:06:48.552Z,419,298,Under-estimated
"Review quarterly project goals","Conduct comprehensive review of quarterly objectives, assess progress against goals, and identify areas for improvement.",completed,high,2025-07-05T07:15:09.284Z,2025-07-06T08:33:07.790Z,2025-07-06T08:33:07.790Z,39,39,Accurate
"Implement error handling middleware","Create robust error handling system with proper logging, user-friendly messages, and graceful degradation.",completed,high,2025-07-03T11:19:31.873Z,2025-07-08T00:46:59.143Z,2025-07-08T00:46:59.143Z,212,314,Over-estimated
"Review and update project timeline","Update project timeline with realistic estimates, dependency mapping, and risk mitigation strategies.",completed,high,2025-07-02T08:39:29.850Z,2025-07-05T05:42:53.034Z,2025-07-05T05:42:53.034Z,151,130,Under-estimated
"Conduct user research interviews","Schedule and conduct user interviews to gather feedback on current features and understand future needs.",completed,low,2025-06-27T11:32:39.346Z,2025-07-11T19:52:15.845Z,2025-07-11T19:52:15.845Z,382,240,Under-estimated
"Implement user authentication system","Implement secure authentication with JWT tokens, password hashing, and session management. Include password reset functionality and email verification.",in-progress,high,2025-06-26T12:50:19.369Z,2025-07-12T09:50:24.631Z,,429,,N/A
"Update server configurations","Update server configurations for security patches, performance improvements, and compliance requirements.",in-progress,medium,2025-06-23T04:00:11.192Z,2025-07-09T23:03:31.732Z,,322,,N/A
"Setup monitoring and logging system","Setup application monitoring with metrics collection, alerting, and log aggregation for production systems.",pending,high,2025-06-22T10:09:26.747Z,2025-06-22T10:09:26.747Z,,266,,N/A
"Design mobile app interface","Create mobile-first interface design with touch-optimized interactions and responsive layout patterns.",completed,medium,2025-06-21T01:12:23.326Z,2025-06-25T22:58:41.345Z,2025-06-25T22:58:41.345Z,318,227,Under-estimated
"Design email templates","Design responsive email templates for notifications, newsletters, and transactional messages with dark mode support.",in-progress,high,2025-06-20T07:12:16.432Z,2025-06-27T19:29:41.179Z,,445,,N/A
"Refactor legacy codebase components","Modernize outdated code patterns, improve code structure, and enhance maintainability while preserving functionality.",pending,low,2025-06-18T23:47:58.039Z,2025-06-18T23:47:58.039Z,,236,,N/A
"Update marketing website layout","Redesign marketing pages with improved conversion focus, better content hierarchy, and modern visual appeal.",completed,medium,2025-06-18T13:48:51.158Z,2025-07-08T06:14:36.499Z,2025-07-08T06:14:36.499Z,156,208,Over-estimated
"Backup production database","Perform scheduled backup of production database with verification of backup integrity and restore procedures.",completed,low,2025-06-18T13:29:09.582Z,2025-06-27T00:47:52.855Z,2025-06-27T00:47:52.855Z,91,122,Over-estimated
"Analyze competitor feature analysis","Research competitor features, pricing strategies, and market positioning to identify opportunities and threats.",in-progress,medium,2025-06-16T18:39:44.436Z,2025-06-19T08:17:05.965Z,,368,,N/A
"Design user onboarding flow","Design intuitive step-by-step onboarding process to help new users understand key features and get started quickly.",in-progress,low,2025-06-13T01:21:28.837Z,2025-06-28T15:24:40.480Z,,396,,N/A
"Create user persona documentation","Document target user personas with demographics, goals, pain points, and behavioral patterns for better product decisions.",pending,medium,2025-06-12T05:43:53.796Z,2025-06-12T05:43:53.796Z,,268,,N/A
"Update component library","Update design system components with latest patterns, improved accessibility, and consistent spacing guidelines.",in-progress,medium,2025-06-09T03:19:16.620Z,2025-06-29T18:32:29.649Z,,177,,N/A
"Define acceptance criteria for features","Define clear, testable acceptance criteria for all user stories ensuring shared understanding across the team.",pending,high,2025-06-09T02:29:59.236Z,2025-06-09T02:29:59.236Z,,204,,N/A
"Backup production database","Perform scheduled backup of production database with verification of backup integrity and restore procedures.",completed,medium,2025-06-06T13:57:08.336Z,2025-07-03T08:17:14.196Z,2025-07-03T08:17:14.196Z,164,113,Under-estimated
"Create accessibility guidelines","Establish accessibility standards including color contrast ratios, keyboard navigation, and screen reader compatibility.",in-progress,medium,2025-06-03T07:11:56.464Z,2025-06-07T11:21:16.198Z,,139,,N/A
"Update documentation wiki","Update internal documentation, API guides, and onboarding materials to reflect recent changes and improvements.",in-progress,low,2025-06-02T05:13:45.355Z,2025-06-19T03:23:40.370Z,,193,,N/A
"Plan sprint backlog for next iteration","Prioritize and estimate user stories for upcoming sprint, ensuring balanced workload and clear acceptance criteria.",completed,medium,2025-06-01T05:11:56.260Z,2025-06-10T00:16:13.189Z,2025-06-10T00:16:13.189Z,80,74,Under-estimated
"Optimize image assets for web","Compress and optimize images for faster loading times while maintaining visual quality across all devices.",completed,medium,2025-05-28T14:56:51.158Z,2025-06-19T06:05:09.453Z,2025-06-19T06:05:09.453Z,196,216,Over-estimated
"Update component library","Update design system components with latest patterns, improved accessibility, and consistent spacing guidelines.",completed,medium,2025-05-27T19:43:45.382Z,2025-06-04T04:51:46.656Z,2025-06-04T04:51:46.656Z,443,492,Over-estimated
"Add real-time notifications feature","Build real-time notification system using WebSockets with proper error handling and offline support.",in-progress,medium,2025-05-27T08:47:09.796Z,2025-06-21T02:57:50.006Z,,231,,N/A
"Implement error handling middleware","Create robust error handling system with proper logging, user-friendly messages, and graceful degradation.",completed,low,2025-05-25T22:40:06.015Z,2025-05-28T00:19:12.168Z,2025-05-28T00:19:12.168Z,410,600,Over-estimated
"Clean up unused code and files","Audit codebase for unused imports, dead code, and outdated patterns. Clean up and optimize for better performance.",pending,medium,2025-05-21T23:09:17.069Z,2025-05-21T23:09:17.069Z,,230,,N/A
"Update server configurations","Update server configurations for security patches, performance improvements, and compliance requirements.",completed,medium,2025-05-20T05:24:54.786Z,2025-07-10T01:18:48.663Z,2025-07-10T01:18:48.663Z,222,212,Under-estimated
"Add unit tests for API endpoints","Write comprehensive test coverage for all API endpoints including edge cases, error scenarios, and authentication flows.",in-progress,low,2025-05-19T06:05:42.453Z,2025-05-19T17:45:42.875Z,,374,,N/A
"Update brand color palette","Refresh brand colors to align with current design trends while maintaining accessibility and brand recognition.",completed,medium,2025-05-17T15:25:56.467Z,2025-05-18T08:08:01.795Z,2025-05-18T08:08:01.795Z,144,118,Under-estimated
"Clean up unused code and files","Audit codebase for unused imports, dead code, and outdated patterns. Clean up and optimize for better performance.",in-progress,medium,2025-05-16T07:29:27.349Z,2025-06-08T13:37:30.663Z,,228,,N/A
"Update server configurations","Update server configurations for security patches, performance improvements, and compliance requirements.",in-progress,high,2025-05-14T20:29:55.878Z,2025-07-07T08:05:21.297Z,,379,,N/A
"Create user persona documentation","Document target user personas with demographics, goals, pain points, and behavioral patterns for better product decisions.",completed,medium,2025-05-14T04:44:20.924Z,2025-06-20T16:39:05.119Z,2025-06-20T16:39:05.119Z,164,99,Under-estimated
"Setup CI/CD pipeline configuration","Configure automated testing, building, and deployment pipeline with proper staging environments and rollback capabilities.",completed,low,2025-05-12T02:47:19.324Z,2025-05-21T01:22:12.033Z,2025-05-21T01:22:12.033Z,336,268,Under-estimated
"Create wireframes for new dashboard","Create detailed wireframes showing user flow, navigation structure, and key interface elements for the new dashboard.",completed,low,2025-05-06T15:16:48.025Z,2025-06-13T21:03:16.020Z,2025-06-13T21:03:16.020Z,300,233,Under-estimated
"Prepare stakeholder presentation","Prepare executive presentation with project status, key metrics, upcoming milestones, and resource requirements.",completed,medium,2025-05-03T22:37:34.858Z,2025-07-03T21:57:52.784Z,2025-07-03T21:57:52.784Z,373,277,Under-estimated
"Add unit tests for API endpoints","Write comprehensive test coverage for all API endpoints including edge cases, error scenarios, and authentication flows.",pending,high,2025-05-02T15:08:21.900Z,2025-05-02T15:08:21.900Z,,468,,N/A
"Review and update security policies","Review current security policies, access controls, and compliance requirements. Update based on latest best practices.",in-progress,medium,2025-04-30T09:54:00.515Z,2025-05-07T09:36:52.662Z,,129,,N/A
"Optimize database query performance","Analyze slow-running queries and implement indexing strategies. Consider query optimization and caching mechanisms.",completed,medium,2025-04-25T05:43:01.052Z,2025-05-31T18:51:24.585Z,2025-05-31T18:51:24.585Z,233,155,Under-estimated
"Fix responsive design issues on mobile","Address layout issues on tablets and smartphones. Ensure proper touch interactions and optimize for various screen sizes.",in-progress,medium,2025-04-24T00:05:51.916Z,2025-05-14T14:09:57.461Z,,387,,N/A
"Prepare stakeholder presentation","Prepare executive presentation with project status, key metrics, upcoming milestones, and resource requirements.",in-progress,medium,2025-04-21T01:31:21.589Z,2025-04-26T08:23:27.874Z,,113,,N/A
"Update dependencies to latest versions","Review and update all project dependencies, checking for security vulnerabilities and breaking changes.",in-progress,medium,2025-04-17T15:56:55.730Z,2025-06-03T19:24:14.911Z,,162,,N/A
"Create user persona documentation","Document target user personas with demographics, goals, pain points, and behavioral patterns for better product decisions.",completed,high,2025-04-17T11:27:57.674Z,2025-06-06T16:20:03.280Z,2025-06-06T16:20:03.280Z,434,483,Over-estimated
"Conduct user research interviews","Schedule and conduct user interviews to gather feedback on current features and understand future needs.",pending,high,2025-04-16T14:37:26.048Z,2025-04-16T14:37:26.048Z,,125,,N/A
"Review error logs and fix issues","Investigate recent error patterns, implement fixes, and establish monitoring to prevent similar issues.",completed,high,2025-04-16T06:26:26.632Z,2025-04-25T00:26:37.103Z,2025-04-25T00:26:37.103Z,93,115,Over-estimated
"Fix responsive design issues on mobile","Address layout issues on tablets and smartphones. Ensure proper touch interactions and optimize for various screen sizes.",in-progress,low,2025-04-16T05:36:29.818Z,2025-05-21T19:31:48.587Z,,148,,N/A
"Implement user authentication system","Implement secure authentication with JWT tokens, password hashing, and session management. Include password reset functionality and email verification.",in-progress,low,2025-04-14T17:56:24.264Z,2025-05-31T23:12:04.617Z,,68,,N/A
"Review error logs and fix issues","Investigate recent error patterns, implement fixes, and establish monitoring to prevent similar issues.",pending,high,2025-04-14T11:28:10.336Z,2025-04-14T11:28:10.336Z,,282,,N/A
